,comms_num,name,comms_text,item_num,item_subject,rec,raw_summ,short_summ,position
0,131,Seaver Wang,"From: Seaver Wang <seaver@thebreakthrough.org>

Sent: Thursday, July 6, 2023 12:49 PM

To: . All Council

Cc: . Ted Nordhaus; Alex Trembath

Subject: Breakthrough Institute Comment Attached Regarding Item 29 Resolution Opposing
Tokyo Electric SO

Attachments: _ BTl Letter to Berkeley City Council.pdf

WARNING: This is not a City of Berkeley email. Do not click links or attachments unless you trust the sender and know the content is
safe.
To Whom It May Concern,

lam Seaver Wang, Co-Director of the Climate and Energy team at the Breakthrough Institute, a US-based environmental

nonprofit research center located in Berkeley, California. It has recently come to our attention that Berkeley City
Councilmember Kate Harrison has recently proposed a new resolution calling for the city of Berkeley to formally oppose

Japan’s planned discharge of objectively harmless wastewater from the Fukushima Daiichi Nuclear Power Plant.

As a Berkeley-based environmental research institution with staff possessing special expertise in oceanography and
nuclear power plant safety, we find this proposed resolution to be a senseless distraction for the city’s public agenda
that is at best political grandstanding, and at worst environmentally counterproductive and harmful to social justice.

As we establish in our attached letter, the proposed release of water poses zero risk to public health and environmental
safety off the coast of Japan, and certainly for Berkeley residents and businesses. We show that a person drinking
nothing but the treated water for an entire year would experience a fraction of the equivalent of a chest X-ray
procedure. We emphasize that the International Atomic Energy Agency has determined in their final report, released
this week, that the planned release will “have a negligible radiological impact” and is “consistent with relevant
international safety standards.”

We have attached our comment on Councilmember Harrison's proposed resolution to this email as a PDF document. —

Yours sincerely,
Seaver Wang

Seaver Wang, Ph.D. (he/him) J
Co-Director, Climate and Energy Program

The Breakthrough Institute

seaver@thebreakthrough.org

Twitter: @wang seaver


----
BREA THROUGH

INSTITU
July 06, 2023
To: Honorable Mayor and Members of the City Council
From: Dr. Seaver Wang and colleagues at the Breakthrough Institute

Subject: We Strongly Oppose Councilmember Harrison's Symbolic and Non-Scientific Proposed Resolution
Criticizing the Government of Japan's Planned Discharge of Wastewater from the Fukushima Daiichi
Nuclear Power Plant.

Any visitor walking along Berkeley's sunny streets will read the same message posted in front of house after
house, in window after window: “In this house we believe science is real.” With Berkeley hosting one of the
nation’s proudest public universities and a prestigious National Laboratory, this communal respect for the
scientific method and for critical analysis should surprise nobody.

As such, we find it highly disappointing that Councilmember Kate Harrison has recently proposed a new
resolution calling for the city of Berkeley to formally oppose Japan's planned discharge of objectively
harmless wastewater from the Fukushima Daiichi Nuclear Power Plant.

Councilmember Harrison's resolution grossly overstates the negligible risks posed by the release of treated
water from the Fukushima facility. If the average person were to drink 2 liters of water per day directly
from the planned Fukushima releases (following desalination) fora full year at the planned upper limit
concentration of 40,500 picocuries/liter (1500 bequerels/L)’, their total added dose of radiation would be
0.0197 millisieverts (Sv)’, the equivalent of less than one-fifth the dose of a medical chest X-ray (0.1 mSv)?,
and approximately the added radiation exposure from a single 5-hour coast-to-coast airline flight (0.02
mSv).’ The planned Fukushima release is already around just one-seventh of the World Health
Organization's threshold for tritium in drinking water.>

1 International Atomic Energy Agency. “IAEA Review of Safety Related Aspects of Handling ALPS-Treated Water at
TEPCO’s Fukushima Daiichi Nuclear Power Station: Report 5: Review Mission to NRA.” 2023.

* 730.5 liters x 1500 Bq/L x 1.8E-11 Sv/Bq (dose coefficient for tritium, in Sv/Bq, from Radiological Aspects. World
Health Organization, 2022. https://www.ncbi.nlm.nih.gov/books/NBK579448/)

3 Harvard Health. “Radiation Risk from Medical Imaging,” September 22, 2010.

https://www.health.harvard. edu/cancer/radiation- risk-from-medical-i imaging.

4 Friedberg, W; Copeland K (2011). “lonizing Radiation i in Earth's Atmosphere and in Space Near Earth"" Civil
Aerospace Medical Institute, Federal Aviation Administration, DOT/FAA/AM- 11/9.

> “Is Fukushima Wastewater Release Safe? What the Science Says.” Nature 618, no. 7967 (June 22, 2023): 894-95.
https://doi.org/10.1038/d41586-023-02057-y.

2054 University Ave ih info@thebreakthrough.org
Suite 500 | www.thebreakthrough.org

Berkeley, CA 94704


----
BREAKTHROUGH

INSTITUTE

Dilution of the Fukushima release by a little over a factor of two would put the release well below the U.S.
Environmental Protection Agency’s threshold for tritium in water of 20,000 pCi/L. Needless to say, the vast
Pacific Ocean is approximately 700,000,000,000 times larger in volume than all the stored wastewater at
Fukushima, which would in any event only be released gradually over the span of decades. Scientific
measurements will struggle to detect any signal from the released water relative to naturally-occuring
background radiation in seawater even within a few tens of kilometers of the release. In their final report
reviewing the safety of water treated at the Fukushima power plant, the International Atomic Energy

_ Agency determined that the planned release will “have a negligible radiological impact” and is “consistent
with relevant international safety standards.”® My colleagues and I at the Breakthrough Institute would be
happy to drink the treated water, if provided, at a future City Council meeting to publicly demonstrate that
the water is entirely safe. )

By the time any water molecules from the coast of Japan reach the coast of California, a oceanic circulation
process requiring around 2-3 years,’ no scientific instrument on Earth will be able to distinguish any
remaining additional radioactivity from the release. Clearly, Councilmember Kate Harrison's claim that the
release “could impact millions of lives and livelihoods in the Pacific region” and “imposes considerable
risks to environmental and human rights across the globe” amounts to nothing but sheer political theater.
The risk to Berkeley “residents and businesses"" is, quite literally, zero.

We further note that many of the experts and organizations that Councilmember Harrison has chosen to
quote represent explicitly anti-nuclear advocacy groups, including Greenpeace International, Friends of the
Earth, and No Nukes Action. These single-mindedly traditionalist activist organizations have remained .
ideologically opposed to the promise of clean nuclear energy for helping societies worldwide act against
climate change. Their critique of the planned Fukushima release is primarily intended to stigmatize
nuclear energy. Councilmember Harrison’s draft resolution meanwhile ignores a vast array of scientifically
rigorous and open-minded researchers, more forward-thinking advocates, and institutions that support
clean nuclear power as a critical tool alongside wind, solar, batteries, and other low-carbon energy sources
in decarbonizing the global energy system.®

_ In response to Councilmember Harrison's invocation of social justice, we assert that anti-nuclear
misinformation represents the far larger and more real injustice faced by Japanese, Asian, and Pacific

6 international Atomic Energy Agency. “IAEA Finds Japan’s Plans to Release Treated Water into the Sea at
Fukushima Consistent with International Safety Standards.” July 4, 2023. °
https://www.iaea.org/newscenter/pressreleases/iaea-finds-japans-plans-to-release-treated-water-into-the-sea-at-
fukushima-consistent-with-international-safety-standards. Se

7 “Ocean Surface Currents | Manoa.Hawaii.Edu/ExploringOurFluidEarth.” Accessed July 2, 2023.
https://manoa.hawaii.edu/exploringourfluidearth/physical/atmospheric-effects/ocean-surface-currents.

8 Build Nuclear Now. “Build Nuclear Now.” Accessed July 2, 2023. https://www.buildnuclearnow.org.

2054 University Ave > Gh info@thebreakthrough.org
Suite 500 www.thebreakthrough.org

Berkeley, CA 94704


----
BREAKTHROUGH
INSTITUTES

peoples because of the exaggerated discourse on the Fukushima water release issue. Anti-nuclear activists,
playing to radiation-related historical traumas and vastly inflating the public health and environmental
risks posed by the release, have inflicted and continue to inflict undue anxiety upon communities across
the Asia-Pacific, while threatening economic harm to the peoples of Fukushima, Miyagi, and Ibaraki
Prefectures in Japan. These organizations would celebrate the shutdown of nuclear power stations across
Asia, even if this prolongs the continued operation of fossil fuel power plants that contribute to climate

change and would directly sicken more Japanese, Korean, or Taiwanese people from.air pollution.

We strongly urge the other members of the Berkeley City Council to reject Councilmember Harrison's empty
resolution in the most forceful terms. And we rebuke Councilmember Harrison for occupying the city's
public agenda with a resolution that is at best political grandstanding, and at worst environmentally
counterproductive and harmful to social justice.

Sincerely yours,

Seaver Wang, PhD. Earth and Ocean Sciences
Co-Director, Climate and Energy

The Breakthrough Institute
seaver@thebreakthrough.org

The Breakthrough Institute
2054 University Ave Suite 500
Berkeley, CA 94704

Berkeley, CA 94704

www.thebreakthrough.org
|
|
|
|
|
2054 University Ave | & info@thebreakthrough.org |
Suite 500 www.thebreakthrough.org |
|",29,Resolution Opposing Tokyo Electric Power Company and the Government of Japan’s Planned Discharge of Wastewater from Fukushima Daiichi Nuclear Power Plant into the Pacific Ocean,"Adopt a Resolution opposing Tokyo Electric Power Company (TEPCO) and the government of Japan’s plan to discharge wastewater from Fukushima Daiichi Nuclear Power Plant into the Pacific Ocean and send copies of this resolution to Secretary Blinken, Senator Dianne Feinstein, Senator Alex Padilla, and Representative Barbara Lee.","{'intermediate_steps': [""Comms #: 131\nName: Seaver Wang\nSummary: Seaver Wang, Co-Director of the Climate and Energy team at the Breakthrough Institute, opposes the proposed resolution by Berkeley City Councilmember Kate Harrison to formally oppose Japan's planned discharge of wastewater from the Fukushima Daiichi Nuclear Power Plant.\nPosition: Oppose"", ""Comms #: 7305\nName: Dr. Seaver Wang and colleagues at the Breakthrough Institute\nSummary: Strongly opposing Councilmember Harrison's proposed resolution criticizing Japan's planned discharge of wastewater from the Fukushima Daiichi Nuclear Power Plant.\nPosition: Oppose"", 'Comms #: 2054\nName: Breakthrough Institute\nSummary: The email argues that the planned release of Fukushima wastewater will have a negligible radiological impact and is consistent with international safety standards.\nPosition: Support', 'Comms #: 2054\nName: Breakthrough Institutes\nSummary: The email criticizes Councilmember Harrison for quoting anti-nuclear advocacy groups and argues that clean nuclear power should be considered alongside other low carbon energy sources.\nPosition: Other', ""Comms #: 123456\nName: Seaver Wang\nSummary: Seaver Wang strongly urges the Berkeley City Council to reject Councilmember Harrison's resolution opposing Tokyo Electric Power Company (TEPCO) and the government of Japan's plan to discharge wastewater from Fukushima Daiichi Nuclear Power Plant into the Pacific Ocean.\nPosition: Oppose""], 'output_text': ""Comms #: 131\nName: Seaver Wang\nSummary: Seaver Wang opposes the proposed resolution by Berkeley City Councilmember Kate Harrison to formally oppose Japan's planned discharge of wastewater from the Fukushima Daiichi Nuclear Power Plant.\nPosition: Oppose\n\nComms #: 7305\nName: Dr. Seaver Wang and colleagues at the Breakthrough Institute\nSummary: Dr. Seaver Wang and colleagues at the Breakthrough Institute strongly oppose Councilmember Harrison's proposed resolution criticizing Japan's planned discharge of wastewater from the Fukushima Daiichi Nuclear Power Plant.\nPosition: Oppose\n\nComms #: 2054\nName: Breakthrough Institute\nSummary: The Breakthrough Institute supports the planned release of Fukushima wastewater, arguing that it will have a negligible radiological impact and is consistent with international safety standards.\nPosition: Support\n\nComms #: 2054\nName: Breakthrough Institutes\nSummary: The Breakthrough Institutes criticizes Councilmember Harrison for quoting anti-nuclear advocacy groups and argues that clean nuclear power should be considered alongside other low carbon energy sources.\nPosition: Other\n\nComms #: 123456\nName: Seaver Wang\nSummary: Seaver Wang opposes Councilmember Harrison's resolution opposing the discharge of wastewater from Fukushima Daiichi Nuclear Power Plant into the Pacific Ocean.\nPosition: Oppose""}",Seaver Wang opposes the proposed resolution by Berkeley City Councilmember Kate Harrison to formally oppose Japan's planned discharge of wastewater from the Fukushima Daiichi Nuclear Power Plant.,Oppose
1,132,Diane Bohn,"From: Diana <nicca@igc.org>
Sent: Friday, July 7, 2023 1:15 PM
To: ; All Council

Subject: ) Please support Council member Harrision's resolution against dumping of radioactive
Fukushima water :

WARNING: This is not a City of Berkeley email. Do not click links or attachments unless you trust the
sender and know the content is safe.

Please support Council member Harrision's resolution against dumping of radioactive Fukushima
water .

Thank you!!

Diana Bohn

District 5",29,Resolution Opposing Tokyo Electric Power Company and the Government of Japan’s Planned Discharge of Wastewater from Fukushima Daiichi Nuclear Power Plant into the Pacific Ocean,"Adopt a Resolution opposing Tokyo Electric Power Company (TEPCO) and the government of Japan’s plan to discharge wastewater from Fukushima Daiichi Nuclear Power Plant into the Pacific Ocean and send copies of this resolution to Secretary Blinken, Senator Dianne Feinstein, Senator Alex Padilla, and Representative Barbara Lee.","{'intermediate_steps': [""Comms #: 132\nName: Diane Bohn\nSummary: Diane Bohn is requesting support for Council member Harrision's resolution against the dumping of radioactive Fukushima water.\nPosition: Support""], 'output_text': ""Comms #: 132\nName: Diane Bohn\nSummary: Diane Bohn is requesting support for Council member Harrision's resolution against the dumping of radioactive Fukushima water.\nPosition: Support""}",Diane Bohn is requesting support for Council member Harrision's resolution against the dumping of radioactive Fukushima water.,Support
2,133,Miya Sommers,"— . .
eee ERR ee EN a I CAC,

From: Miya Sommers <miyasommers@gmail.com>
Sent: Monday, July 10, 2023 10:41 AM

To: All Council; City Clerk

Cc: nikkeiresisters@gmail.com

Subject: Yes to Consent Item #29 - Oppose Discharge of Wamewater from Fukushima Daiichi
Nuclear Power Plant into the Pacific Oceam

WARNING: This is not a City of Berkeley email. Do not click links or r attachments unless you trust the sender and know the content is
safe.
Dear Mayor Arreguin and members of the Berkeley City Council: ~

| am writing on behalf of Nikkei Resisters and as someone who lived and now works in the city of Berkeley, to
urge you to adopt by consent the Resolution “Opposing Tokyo Electric Power Company and the
Government of Japan's Planned Discharge of Wastewater from Fukushima Daiichi Nuclear Power Plant into
the Pacific Ocean (Consent Item #29)” at tomorrow's Council meeting.

The government of Japan and TEPCO (Tokyo Electric Power Company) plan to soon begin dumping 1.3
million tons of nuclear radioactive wastewater into the Pacific Ocean. Currents will bring it here and,
eventually, around the world. A 2012 study found evidence that bluefin tuna had transported radionuclides from
Fukushima across the Pacific to California. Moreover, traces of Fukushima radiation have been detected off
the coast of California since 2015. 70% of the water supposedly “treated” with the ALPS (Advanced Liquid
Processing System) which TEPCO claims to be safe does not meet International regulatory standards for
discharge. Strontium-90, one of the radionuclides found in the “treated” water, is among the most hazardous
radionuclides; once in the body, Strontium-90 acts like calcium and is readily incorporated into bones and
teeth, where it can cause the cancers of bone, bone marrow, and soft tissues around the bone. TEPCO’s
“safety” claim does not take into consideration the potential impact of OBT (Organically Bound Tritium) on a
human body; once it enters the body, OBT can replace water in soft tissues, causing damage to DNA and cell
mutations. Because of TEPCO’s inadequate sampling practices, lack of data on what the water actually
contains, and lack of analysis on the transboundary issues, bioaccumulation and bioconcentration of the
discharge, experts like Robert H. Richmond, director of the Kewalo Marine Laboratory at the University of
Hawaii at Manoa, are calling the plan “ill-advised” and premature.

The people ¢ of Japan and neighboring nations such as Korea, China, the Philippines, as well as the Pacific -
Island nations, overwhelmingly oppose the dumping. The Pacific Islands Forum assembled a working group of
international, independent, interdisciplinary scientists and experts to research alternatives and figure out the
best solution, which is to solidify the contaminated water which will remain on site and, therefore, will have very
little contact with humans. While it may not be the perfect solution, the cement encasement is far safer than
dumping it in the ocean; the cement will contain the tritium and it will not be released.

The IAEA (International Atomic Energy Agency) which has approved the plan, has a contradictory dual
purpose of regulating nuclear energy and promoting the nuclear energy industry at the same time. For this
reason, the IAEA is often seen as biased. An internal IAEA document recently leaked by a whistleblower
suggests that the agency has been colluding with the government of Japan by withholding certain data from
the final report at the request of the Japanese government.

it is our moral obligation to leave our oceans in as pristine a condition as possible for future »
generations. | urge you to vote in support of the resolution “Opposing Tokyo Electric Power Company |
and the Government of Japan’s Planned Discharge of Wastewater from Fukushima Daiichi Nuclear Power

‘ Plant into the Pacific Ocean” at an upcoming city council meeting on July 11th, on behalf of concerned
citizens like myself.

----
Thank you to Council Member Harrison for being the author on the consent item.
Sincerely,
Miya Sommers

Miya Sommers
miyasommers@gmail.com",29,Resolution Opposing Tokyo Electric Power Company and the Government of Japan’s Planned Discharge of Wastewater from Fukushima Daiichi Nuclear Power Plant into the Pacific Ocean,"Adopt a Resolution opposing Tokyo Electric Power Company (TEPCO) and the government of Japan’s plan to discharge wastewater from Fukushima Daiichi Nuclear Power Plant into the Pacific Ocean and send copies of this resolution to Secretary Blinken, Senator Dianne Feinstein, Senator Alex Padilla, and Representative Barbara Lee.","{'intermediate_steps': ['Comms #: 133\nName: Miya Sommers\nSummary: Miya Sommers urges the Berkeley City Council to adopt a resolution opposing the discharge of wastewater from the Fukushima Daiichi Nuclear Power Plant into the Pacific Ocean.\nPosition: Support', 'Comms #: 123456\nName: Miya Sommers\nSummary: Miya Sommers urges the recipient to adopt a resolution opposing the plan to discharge wastewater from Fukushima Daiichi Nuclear Power Plant into the Pacific Ocean.\nPosition: Oppose'], 'output_text': 'Comms #: 133\nName: Miya Sommers\nSummary: Miya Sommers urges the Berkeley City Council to adopt a resolution opposing the discharge of wastewater from the Fukushima Daiichi Nuclear Power Plant into the Pacific Ocean.\nPosition: Support\n\nComms #: 123456\nName: Miya Sommers\nSummary: Miya Sommers urges the recipient to adopt a resolution opposing the plan to discharge wastewater from Fukushima Daiichi Nuclear Power Plant into the Pacific Ocean.\nPosition: Oppose'}",Miya Sommers urges the Berkeley City Council to adopt a resolution opposing the discharge of wastewater from the Fukushima Daiichi Nuclear Power Plant into the Pacific Ocean.,Support
3,135,Carole Marasovic,"From: carole marasovic <daphnesflight@yahoo.com>
Sent: a Monday, July 10, 2023 4:53 AM

To: . _ All Council

Subject: Affordable housing preference

WARNING: This is not a City of Berkeley email. Do not click links or attachments unless you trust the sender and know the content is
safe.

Dear Mayor and City Council:
Please refer to the transcript below of this past Saturday, July 8, 2023 PBS interview which identifies the
disproportionately high rate of California homelessness not only among those over 50, many of whom have worked

physically demanding low-paying jobs, and the disproportionate rate of persons who are not only black but also Native
American. Please consider the disparities of Native Americans in housing preference.

Thank you.

Carole Marasovic

-to-become-unhoused-in-

california-new-study-provides-insights",32,Referral Response: Affordable Housing Preference Policy for Rental Housing Created Through the Below Market Rate and Housing Trust Fund Programs,"Adopt a Resolution to create an Affordable Housing Preference Policy applicable to new residential housing units created via the Below Market-Rate (BMR) and the Housing Trust Fund (HTF) programs consistent with Fair Housing law and government funder approvals, and direct the City Manager to adopt guidelines to administer the Housing Preference Policy.","{'intermediate_steps': ['Comms #: 135\nName: Carole Marasovic\nSummary: Carole Marasovic requests the consideration of disparities of Native Americans in housing preference.\nPosition: Other'], 'output_text': 'Comms #: 135\nName: Carole Marasovic\nSummary: Carole Marasovic requests the consideration of disparities of Native Americans in housing preference.\nPosition: Other'}",Carole Marasovic requests the consideration of disparities of Native Americans in housing preference.,Other
4,136,Chase Hommeyer,"—
a

From:
Sent:
To:

Subject:

Chase H <chase.hommeyer@gmail.com>
Thursday, July 6, 2023 6:43 AM

All Council

Support FULL restoration of Strawberry Creek!

WARNING: This is not a City of Berkeley email. Do not click links or attachments unless you trust the sender and know the content is

'- Chase

; safe.
Dear Honorable Mayor and City Council,

On July 11, 2023 you will be considering the approval of the Civic Center Plan—please give your full
support for the daylighting of Strawberry Creek in Civic Center Park!

’ve lived in San Francisco and Berkeley for my whole life and doing a FULL restoration of Strawberry
Creek is an issue I’m very passionate about.

| urge you to please advocate changing the description of the daylighting project from its current

phrasing to this: “Alternate plan with a daylighted Strawberry Creek, design and flow to be
determined thru future study.""

The way the Civic Center Plan is written to describe the daylighting of the Creek says it is an ""alternate
scenario"" with just.a “partial restoration”. | request that the Plan not assume any limitations on the
location and flow of the Creek. Please do a full planning and design study for the daylighting. The
above phrasing can help to secure funding.

Thank you,
Chase Hommeyer",33,Adoption — Civic Center Phase II — Design Concept,"Adopt a Resolution approving Berkeley’s Civic Center Design Concept Plan, and declaring Council’s intention to support the preferred design concept and necessary future studies and projects articulated in the plan.","{'intermediate_steps': ['Comms #: 136\nName: Chase Hommeyer\nSummary: Chase Hommeyer supports the full restoration of Strawberry Creek and urges the City Council to change the description of the daylighting project to allow for a full planning and design study.\nPosition: Support'], 'output_text': 'Comms #: 136\nName: Chase Hommeyer\nSummary: Chase Hommeyer supports the full restoration of Strawberry Creek and urges the City Council to change the description of the daylighting project to allow for a full planning and design study.\nPosition: Support'}",Chase Hommeyer supports the full restoration of Strawberry Creek and urges the City Council to change the description of the daylighting project to allow for a full planning and design study.,Support
